{
  "created_at": "2026-08-21T12:20:02.419690+00:00",
  "metadata": {
    "execution_context_hash": "afc9826c9e8bb259069fe30b5b55c3927eaf97849c2eb1893be8811aecb18eb8",
    "method_version": "v0.3",
    "runner_version": "0.1.0-beta",
    "transition_history": [
      {
        "from": "AUDITING",
        "reason": "Starting hardening run",
        "timestamp": "2026-08-21T12:20:02.419899+00:00",
        "to": "AUDITING"
      },
      {
        "from": "PATCH_PROPOSED",
        "reason": "Audit and simplification complete",
        "timestamp": "2026-08-21T12:20:02.466726+00:00",
        "to": "PATCH_PROPOSED"
      },
      {
        "from": "VERIFIED",
        "reason": "Verification tests passed",
        "timestamp": "2026-08-21T12:20:02.479936+00:00",
        "to": "VERIFIED"
      },
      {
        "from": "KNOWLEDGE_CANDIDATE",
        "reason": "Knowledge candidates formulated",
        "timestamp": "2026-08-21T12:20:02.489325+00:00",
        "to": "KNOWLEDGE_CANDIDATE"
      }
    ]
  },
  "phases_executed": [
    "question",
    "delete",
    "simplify",
    "verify",
    "codify"
  ],
  "state": "KNOWLEDGE_CANDIDATE",
  "target_hash": "683ae673e993210fc3c9960d1876d575fd2015c1d65e598c5ee070b734796e8e",
  "target_path": "/Users/felipe_gonzalez/Developer/hardening-loop/src/hardening_loop",
  "updated_at": "2026-08-21T12:20:02.489325+00:00",
  "work_unit_id": "wu-683ae673e993"
}