{
  "created_at": "2026-08-21T13:40:12.495275+00:00",
  "metadata": {
    "execution_context_hash": "f0cd279fd89f781517bf1331ab018916de0bd81fac150bcfae92553df8f3c844",
    "method_version": "v0.3",
    "runner_version": "0.1.0-beta",
    "transition_history": [
      {
        "from": "AUDITING",
        "reason": "Starting hardening run",
        "timestamp": "2026-08-21T13:40:12.495474+00:00",
        "to": "AUDITING"
      },
      {
        "from": "PATCH_PROPOSED",
        "reason": "Audit and simplification complete",
        "timestamp": "2026-08-21T13:40:12.528172+00:00",
        "to": "PATCH_PROPOSED"
      },
      {
        "from": "VERIFIED",
        "reason": "Verification tests passed",
        "timestamp": "2026-08-21T13:40:12.537937+00:00",
        "to": "VERIFIED"
      },
      {
        "from": "KNOWLEDGE_CANDIDATE",
        "reason": "Knowledge candidates formulated",
        "timestamp": "2026-08-21T13:40:12.549508+00:00",
        "to": "KNOWLEDGE_CANDIDATE"
      }
    ]
  },
  "phases_executed": [
    "question",
    "delete",
    "simplify",
    "verify",
    "codify"
  ],
  "state": "KNOWLEDGE_CANDIDATE",
  "target_hash": "344a8b52f4b841d712529fd652917648f9f7b2125a6784e7ef90a0939baec778",
  "target_path": "/Users/felipe_gonzalez/Developer/hardening-loop/fixtures/qwen-tool-loop.py",
  "updated_at": "2026-08-21T13:40:12.549508+00:00",
  "work_unit_id": "wu-344a8b52f4b8"
}